PROVINCE,"CITY/ MUNICIPALITY",BARANGAY,"LEVEL FROM","LEVEL TO",TYPE,"DATE OF SUSPENSION [m/d/Y]","TIME OF SUSPENSION [24:00]","DATE RESUMED [m/d/Y]","TIME RESUMED [24:00]",REMARKS
"ILOCOS NORTE",Province-Wide,none,Pre-school,Tertiary,All,2025-11-10,06:00,2025-11-12,07:00,
"ILOCOS SUR",Province-Wide,none,Pre-school,Tertiary,All,2025-11-10,07:00,2025-11-12,07:00,"Executive Order No. 29, Series of 2025 dated November 08, 2025 at 11:34 AM - An Order Suspending Classes in All Levels of Public and Private Schools & Work in Public Offices in the Province of Ilocos Sur on 10 November 2025, as a preemptive measure in response to Typhoon <br>“UWANG” (FUNG-WONG)."
"ILOCOS SUR",Province-Wide,none,Pre-school,Tertiary,All,2025-11-11,07:00,2025-11-12,07:00,"Executive Order No. 31, Series of 2025 dated November 10, 2025 at 09:07 PM<br>-An order adopting the suspension of classes and extending the suspension of work in public offices in the province of Ilocos Sur until 11 November 2025, in view of ongoing risks from Typhoon “UWAN” (FUNG-WONG) and in support of disaster response operations."
"LA UNION",Province-Wide,none,Pre-school,Tertiary,All,2025-11-10,06:00,2025-11-12,07:00," Executive Order No. 36 'Classes in all public and private schools (all levels) will be suspended on Monday, November 10, 2025, due to the anticipated effects of TC Uwan'"
PANGASINAN,Province-Wide,none,Pre-school,Tertiary,All,2025-11-10,08:00,2025-11-12,07:00,"Presidential Memorandum Circular No. 106 (Class suspension on 10-11 November 2025)"
